title,website,reason
Python Development and Python Programming Fundamentals,RealDiscount,Expired coupon
Entry Certificate Business Analysis (IIBA ECBA) Mock Exams,RealDiscount,Expired coupon
SAP Exam Pack–Certification_STC2405-SAP Cloud ALM-Q1-Q2-Q3,RealDiscount,Ad/Sponsored content
Android apps with artificial Intelligence,RealDiscount,Expired coupon
Generative AI : Create an impressive AI Art 2025,RealDiscount,Expired coupon
Sigmund Freud: Phân tâm học và những giấc mơ,RealDiscount,Expired coupon
Mental Health for the Workplace,RealDiscount,Expired coupon
Automate Construction Project with Artificial Intelligence,RealDiscount,Ad/Sponsored content
ISO/IEC 27701: Implement Privacy Management Step by Step,RealDiscount,Expired coupon
Developing successful Professional Relationships,RealDiscount,Expired coupon
Professional Certificate: Product Management and Development,RealDiscount,Expired coupon
CompTIA Cybersecurity Analyst (CySA+)  - Ace the CS0-003,RealDiscount,Expired coupon
AI for CFOs: Mastering the Future of Finance Accounting,RealDiscount,Ad/Sponsored content
Complete Preparation for the Cisco 350-401 ENCOR Exam (2025),RealDiscount,Expired coupon
Estadística: Ji-cuadrada y análisis de varianza con Excel,RealDiscount,Expired coupon
Emotional Intelligence in Leadership,RealDiscount,Expired coupon
Implement ISO 37000 Step by Step,RealDiscount,Expired coupon
